<?xml version="1.0" encoding="UTF-8" ?>
<!DOCTYPE netmsgs PUBLIC "-//www.roadnarrows.com//DTD NETMSGS 1.0//EN"
          "http://www.roadnarrows.com/xml/netmsgs/1.0/netmsgs.dtd">

<!--
 - Package: BotSense
 - Module:  bsNull
 - File:    bsNullMsgs.xml
 -

/*!
 \file

  $LastChangedDate$
  $Rev$

  \brief Client - bsProxy server /dev/null device messages.
  
  \author Robin Knight (robin.knight@roadnarrows.com)
  
  \par Copyright:
  (C) 2010.  RoadNarrows LLC.
  (http://www.roadnarrows.com)
  \n All Rights Reserved
*/

 - Permission is hereby granted, without written agreement and without
 - license or royalty fees, to use, copy, modify, and distribute this
 - software and its documentation for any purpose, provided that
 - (1) The above copyright notice and the following two paragraphs
 - appear in all copies of the source code and (2) redistributions
 - including binaries reproduces these notices in the supporting
 - documentation.   Substantial modifications to this software may be
 - copyrighted by their authors and need not follow the licensing terms
 - described here, provided that the new terms are clearly indicated in
 - all files where they apply.
 -
 - IN NO EVENT SHALL THE AUTHOR, ROADNARROWS LLC, OR ANY MEMBERS/EMPLOYEES
 - OF ROADNARROW LLC OR DISTRIBUTORS OF THIS SOFTWARE BE LIABLE TO ANY
 - PARTY FOR DIRECT, INDIRECT, SPECIAL, INCIDENTAL, OR CONSEQUENTIAL
 - DAMAGES ARISING OUT OF THE USE OF THIS SOFTWARE AND ITS DOCUMENTATION,
 - EVEN IF THE AUTHORS OR ANY OF THE ABOVE PARTIES HAVE BEEN ADVISED OF
 - THE POSSIBILITY OF SUCH DAMAGE.
 -
 - THE AUTHOR AND ROADNARROWS LLC SPECIFICALLY DISCLAIM ANY WARRANTIES,
 - INCLUDING, BUT NOT LIMITED TO, THE IMPLIED WARRANTIES OF MERCHANTABILITY AND
 - FITNESS FOR A PARTICULAR PURPOSE. THE SOFTWARE PROVIDED HEREUNDER IS ON AN
 - "AS IS" BASIS, AND THE AUTHORS AND DISTRIBUTORS HAVE NO OBLIGATION TO
 - PROVIDE MAINTENANCE, SUPPORT, UPDATES, ENHANCEMENTS, OR MODIFICATIONS.
 -
-->

<netmsgs encoding="itv" endian="big">

  <!-- ........................................................................
    - Meta Data to Tweak Source Generation
    ....................................................................... -->
  <meta>
    <brief>
      BotSense bsProxy server - client /dev/null NetMsgs XML Definition
    </brief>
    <ns>BsNull</ns>
    <prologue lang="h">
#include "botsense/BotSense.h"
    </prologue>
    <epilogue lang="h"></epilogue>
    <prologue lang="c"></prologue>
    <epilogue lang="c"></epilogue>
    <prologue lang="python"></prologue>
    <epilogue lang="python"></epilogue>
  </meta>

  <!-- ........................................................................
    - Extended Field Types (Optional)
    ....................................................................... -->
  <field_types>
  </field_types>


  <!-- ........................................................................
    - Message Definitions
    ....................................................................... -->
  <msg_types>

    <!-- Null Write Request -->
    <msgdef msgid="ReqWrite">
      <fielddef fname="writebuf" ftype="u8[]" />
    </msgdef>

    <!-- Null Write Response -->
    <msgdef msgid="RspWrite">
      <fielddef fname="byteswritten" ftype="u8" />
    </msgdef>

  </msg_types>

</netmsgs>
