<?xml version="1.0" encoding="UTF-8" ?>
<!DOCTYPE netmsgs PUBLIC "-//www.roadnarrows.com//DTD NETMSGS 1.0//EN"
          "http://www.roadnarrows.com/xml/netmsgs/1.0/netmsgs.dtd">

<!--
 - Package: Hekateros
 - Module:  bsHek
 - File:    bsHekMsgs.xml
 -

/*!
 \file

  $LastChangedDate: 2012-09-18 14:15:27 -0600 (Tue, 18 Sep 2012) $
  $Rev: 2286 $

  \brief BotSense client - bsProxy server Hekateros device messages.
  
  \author Robin Knight (robin.knight@roadnarrows.com)
  
 -  \copyright
 -    \h_copy 2012-2017. RoadNarrows LLC.\n
 -    http://www.roadnarrows.com\n
 -    All Rights Reserved
*/

 - Permission is hereby granted, without written agreement and without
 - license or royalty fees, to use, copy, modify, and distribute this
 - software and its documentation for any purpose, provided that
 - (1) The above copyright notice and the following two paragraphs
 - appear in all copies of the source code and (2) redistributions
 - including binaries reproduces these notices in the supporting
 - documentation.   Substantial modifications to this software may be
 - copyrighted by their authors and need not follow the licensing terms
 - described here, provided that the new terms are clearly indicated in
 - all files where they apply.
 -
 - IN NO EVENT SHALL THE AUTHOR, ROADNARROWS LLC, OR ANY MEMBERS/EMPLOYEES
 - OF ROADNARROW LLC OR DISTRIBUTORS OF THIS SOFTWARE BE LIABLE TO ANY
 - PARTY FOR DIRECT, INDIRECT, SPECIAL, INCIDENTAL, OR CONSEQUENTIAL
 - DAMAGES ARISING OUT OF THE USE OF THIS SOFTWARE AND ITS DOCUMENTATION,
 - EVEN IF THE AUTHORS OR ANY OF THE ABOVE PARTIES HAVE BEEN ADVISED OF
 - THE POSSIBILITY OF SUCH DAMAGE.
 -
 - THE AUTHOR AND ROADNARROWS LLC SPECIFICALLY DISCLAIM ANY WARRANTIES,
 - INCLUDING, BUT NOT LIMITED TO, THE IMPLIED WARRANTIES OF MERCHANTABILITY AND
 - FITNESS FOR A PARTICULAR PURPOSE. THE SOFTWARE PROVIDED HEREUNDER IS ON AN
 - "AS IS" BASIS, AND THE AUTHORS AND DISTRIBUTORS HAVE NO OBLIGATION TO
 - PROVIDE MAINTENANCE, SUPPORT, UPDATES, ENHANCEMENTS, OR MODIFICATIONS.
 -
-->

<netmsgs encoding="itv" endian="big">

  <!-- ........................................................................
    - Meta Data to Tweak Source Generation
    ....................................................................... -->
  <meta>
    <brief>
      \h_botsense Server/Client Hekateros NetMsgs XML Definitions.
    </brief>
    <ns>BsHek</ns>
    <prologue lang="h">
#include "botsense/BotSense.h"
#include "Dynamixel/Dynamixel.h"
    </prologue>
    <epilogue lang="h"></epilogue>
    <prologue lang="c"></prologue>
    <epilogue lang="c"></epilogue>
    <prologue lang="python">
    </prologue>
    <epilogue lang="python"></epilogue>
  </meta>

  <!-- ........................................................................
    - Extended Field Types (Optional)
    ....................................................................... -->
  <field_types>
    <ftypedef ftid="ServoState" ftype="struct">
      <fielddef fname="servo_id"    ftype="u8" />
      <fielddef fname="goal_speed"  ftype="s16" />
      <fielddef fname="goal_pos"    ftype="s16" />
    </ftypedef>

    <ftypedef ftid="ServoStateVec" ftype="ServoState[]" size="DYNA_ID_NUMOF" />

    <ftypedef ftid="ServoIdVec" ftype="u8[]" size="DYNA_ID_NUMOF" />

    <ftypedef ftid="ServoHealth" ftype="struct">
      <fielddef fname="servo_id"    ftype="u8" />
      <fielddef fname="alarms"      ftype="u8" />
      <fielddef fname="load"        ftype="s16" />
      <fielddef fname="volts"       ftype="u16" />
      <fielddef fname="temp"        ftype="u16" />
    </ftypedef>

    <ftypedef ftid="ServoHealthVec" ftype="ServoHealth[]"
                                    size="DYNA_ID_NUMOF" />
  </field_types>


  <!-- ........................................................................
    - Message Definitions
    ....................................................................... -->
  <msg_types>

    <!-- Hekateros USB Serial Open Request Arguments Sub-Message -->
    <msgdef msgid="ReqOpenArgs">
      <fielddef fname="baudrate"  ftype="u32" />
    </msgdef>

    <!-- Get Version Request -->
    <msgdef msgid="ReqGetVersion" />

    <!-- Get Version Request Response) -->
    <msgdef msgid="RspGetVersion">
      <fielddef fname="version"    ftype="string" />
    </msgdef>

    <!-- Move At Speed To Request (State Response) -->
    <msgdef msgid="ReqMoveAtSpeedTo">
      <fielddef fname="move" ftype="ServoStateVec" />
    </msgdef>

    <!-- Get  At Speed To Request (State Response) -->
    <msgdef msgid="ReqGetState" />

    <!-- Freeze the Arm Request (State Response) -->
    <msgdef msgid="ReqFreeze" />

    <!-- Emergency Stop the Arm Request (State Response) -->
    <msgdef msgid="ReqEStop" />

    <!-- Calibrate Request (State Response) -->
    <msgdef msgid="ReqCalibrate" />

    <!-- State Response -->
    <msgdef msgid="RspState">
      <fielddef fname="state" ftype="ServoStateVec" />
    </msgdef>

    <!-- Get Health Request (Health Response) -->
    <msgdef msgid="ReqGetHealth">
      <fielddef fname="servo_id" ftype="ServoIdVec" />
    </msgdef>

    <!-- Get Health Response) -->
    <msgdef msgid="RspGetHealth">
      <fielddef fname="health" ftype="ServoHealthVec" />
    </msgdef>

    <!-- Clear Alarms Request (Ok Response) -->
    <msgdef msgid="ReqClearAlarms">
      <fielddef fname="servo_id" ftype="ServoIdVec" />
    </msgdef>

  </msg_types>

</netmsgs>
